,number,value,datetime_start,datetime_complete,duration,params_dropout,params_learning_rate,params_num_layers,params_rnn_type,params_units,user_attrs_pruned,user_attrs_training_time,state
96,96,0.17327995853448916,2025-02-02 21:51:24.052900,2025-02-02 21:56:49.638236,0 days 00:05:25.585336,0.30000000000000004,0.0003770455206635174,3,GRU,128,,325.2303080558777,COMPLETE
97,97,0.16981185031630783,2025-02-02 21:56:49.638501,2025-02-02 22:10:06.285843,0 days 00:13:16.647342,0.30000000000000004,0.0004146621486910703,3,GRU,128,,796.5541405677795,COMPLETE
98,98,0.190662265867792,2025-02-02 22:10:06.286116,2025-02-02 22:13:46.793213,0 days 00:03:40.507097,0.30000000000000004,0.00020798272134321948,3,GRU,128,,220.41629600524902,COMPLETE
99,99,0.18696593779152812,2025-02-02 22:13:46.793486,2025-02-02 22:20:56.374860,0 days 00:07:09.581374,0.30000000000000004,0.00035733442217533343,3,GRU,128,,429.4879071712494,COMPLETE
100,100,0.19179643322144302,2025-02-02 22:20:56.375136,2025-02-02 22:28:13.521744,0 days 00:07:17.146608,0.30000000000000004,0.00031381292038744774,3,GRU,96,,437.0696461200714,COMPLETE
101,101,0.17824866055450297,2025-02-02 22:28:13.522007,2025-02-02 22:32:09.212823,0 days 00:03:55.690816,0.4,0.000439149148087023,3,GRU,128,,235.5976448059082,COMPLETE
102,102,0.18368642992613748,2025-02-02 22:32:09.213102,2025-02-02 22:37:22.543756,0 days 00:05:13.330654,0.30000000000000004,0.0006936921562142907,3,GRU,128,,313.237263917923,COMPLETE
103,103,0.1901243350669423,2025-02-02 22:37:22.544023,2025-02-02 22:41:32.815873,0 days 00:04:10.271850,0.4,0.0004122682447556497,3,GRU,128,,250.1787269115448,COMPLETE
104,104,0.278049715527025,2025-02-02 22:41:32.816146,2025-02-02 22:43:28.676685,0 days 00:01:55.860539,0.1,0.007162575651577786,2,LSTM,32,,115.81979870796204,COMPLETE
105,105,0.19090108235229986,2025-02-02 22:43:28.676953,2025-02-02 22:49:42.454032,0 days 00:06:13.777079,0.30000000000000004,0.00038790252606754264,3,GRU,128,,373.6839487552643,COMPLETE
106,106,0.17696390646943483,2025-02-02 22:49:42.454319,2025-02-02 22:58:02.940774,0 days 00:08:20.486455,0.4,0.0006341980333629268,3,GRU,128,,500.3926441669464,COMPLETE
107,107,0.17667861949340055,2025-02-02 22:58:02.941052,2025-02-02 23:06:40.060323,0 days 00:08:37.119271,0.30000000000000004,0.0006172686900729153,3,GRU,128,,517.0262742042542,COMPLETE
108,108,0.2821936767501365,2025-02-02 23:06:40.060599,2025-02-02 23:10:25.600989,0 days 00:03:45.540390,0.0,0.004312901690978519,1,GRU,32,,225.50115299224854,COMPLETE
109,109,0.19702822183380542,2025-02-02 23:10:25.601281,2025-02-02 23:16:15.714586,0 days 00:05:50.113305,0.4,0.0007659531020107457,3,GRU,128,,350.0201807022095,COMPLETE
110,110,0.1729266104035075,2025-02-02 23:16:15.714865,2025-02-02 23:22:14.839163,0 days 00:05:59.124298,0.4,0.0010654727622193647,3,GRU,128,,359.0309839248657,COMPLETE
111,111,0.20090255096558965,2025-02-02 23:22:14.839428,2025-02-02 23:25:23.488795,0 days 00:03:08.649367,0.30000000000000004,0.0015333630102510097,3,GRU,96,,188.57067799568176,COMPLETE
112,112,0.18079990828769174,2025-02-02 23:25:23.489075,2025-02-02 23:30:12.012198,0 days 00:04:48.523123,0.4,0.0011359825542407176,3,GRU,128,,288.4297218322754,COMPLETE
113,113,0.2079498457530835,2025-02-02 23:30:12.012470,2025-02-02 23:36:24.856060,0 days 00:06:12.843590,0.4,0.001066546530580398,3,GRU,128,,372.75287222862244,COMPLETE
114,114,0.19510311869519328,2025-02-02 23:36:24.856334,2025-02-02 23:40:54.335674,0 days 00:04:29.479340,0.4,0.0032292780247774183,3,LSTM,96,,269.4040062427521,COMPLETE
115,115,0.1885955263345015,2025-02-02 23:40:54.335968,2025-02-02 23:51:14.097998,0 days 00:10:19.762030,0.4,0.0004343266959676071,3,GRU,96,,619.6833462715149,COMPLETE
116,116,0.20723177357732814,2025-02-02 23:51:14.098291,2025-02-02 23:54:55.476468,0 days 00:03:41.378177,0.4,0.0017119696486652188,2,GRU,128,,221.30415964126587,COMPLETE
117,117,0.3092831120023741,2025-02-02 23:54:55.476738,2025-02-02 23:57:46.507120,0 days 00:02:51.030382,0.2,0.005995227855086325,3,GRU,32,,170.98413491249084,COMPLETE
118,118,0.17776476280302708,2025-02-02 23:57:46.507394,2025-02-03 00:04:14.985246,0 days 00:06:28.477852,0.30000000000000004,0.0005790372871600691,3,GRU,128,,388.3846158981323,COMPLETE
119,119,0.19272202401848904,2025-02-03 00:04:14.985517,2025-02-03 00:08:32.642693,0 days 00:04:17.657176,0.4,0.0005640409050444461,3,GRU,128,,257.56401777267456,COMPLETE
120,120,,2025-02-03 00:08:32.642967,2025-02-03 00:17:08.471836,0 days 00:08:35.828869,0.5,0.0008606994043131746,3,LSTM,128,"Exception: OutOfMemoryError('CUDA out of memory. Tried to allocate 17.05 GiB. GPU 0 has a total capacity of 23.64 GiB of which 16.49 GiB is free. Process 2920697 has 7.11 GiB memory in use. Of the allocated memory 1.02 GiB is allocated by PyTorch, and 5.63 GiB is reserved by PyTorch but unallocated. If reserved but unallocated memory is large try setting PYTORCH_CUDA_ALLOC_CONF=expandable_segments:True to avoid fragmentation.  See documentation for Memory Management  (https://pytorch.org/docs/stable/notes/cuda.html#environment-variables)')",,PRUNED
121,121,0.17702298976626504,2025-02-03 00:17:08.472013,2025-02-03 00:27:18.973425,0 days 00:10:10.501412,0.30000000000000004,0.0006795750660329402,3,GRU,128,,610.407217502594,COMPLETE
122,122,0.20160604902062154,2025-02-03 00:27:18.973696,2025-02-03 00:34:33.559426,0 days 00:07:14.585730,0.4,0.0007114282787974801,3,LSTM,96,,434.50983119010925,COMPLETE
123,123,,2025-02-03 00:34:33.559702,2025-02-03 00:41:22.534239,0 days 00:06:48.974537,0.1,0.0028075061192885204,3,LSTM,128,"Exception: OutOfMemoryError('CUDA out of memory. Tried to allocate 17.05 GiB. GPU 0 has a total capacity of 23.64 GiB of which 16.49 GiB is free. Process 2920697 has 7.11 GiB memory in use. Of the allocated memory 1.13 GiB is allocated by PyTorch, and 5.53 GiB is reserved by PyTorch but unallocated. If reserved but unallocated memory is large try setting PYTORCH_CUDA_ALLOC_CONF=expandable_segments:True to avoid fragmentation.  See documentation for Memory Management  (https://pytorch.org/docs/stable/notes/cuda.html#environment-variables)')",,PRUNED
124,124,0.17298314470588697,2025-02-03 00:41:22.534509,2025-02-03 00:50:39.687431,0 days 00:09:17.152922,0.4,0.0009214210441447119,3,GRU,128,,557.0457489490509,COMPLETE
125,125,0.17618212055762605,2025-02-03 00:50:39.687709,2025-02-03 00:57:42.277266,0 days 00:07:02.589557,0.4,0.0009131973887759126,3,GRU,128,,422.4984760284424,COMPLETE
126,126,0.32744965203054616,2025-02-03 00:57:42.277534,2025-02-03 00:59:44.254313,0 days 00:02:01.976779,0.30000000000000004,0.004313933678709504,3,GRU,128,,121.88324046134949,COMPLETE
127,127,0.19021994484707636,2025-02-03 00:59:44.254591,2025-02-03 01:02:54.246810,0 days 00:03:09.992219,0.5,0.0008537804492852198,3,GRU,128,,189.90082931518555,COMPLETE
