,number,value,datetime_start,datetime_complete,duration,params_d_ff,params_d_model,params_decomp_method,params_down_sampling_layers,params_down_sampling_window,params_dropout,params_e_layers,params_learning_rate,params_moving_avg,params_top_k,user_attrs_pruned,user_attrs_training_time,state
113,113,0.26549681000746633,2025-01-29 01:55:41.389264,2025-01-29 02:11:47.148444,0 days 00:16:05.759180,64,16,moving_avg,2,2,0.2,2,0.0001379938742703353,11,2,,965.6279056072235,COMPLETE
114,114,0.2667334428975159,2025-01-29 01:59:49.834904,2025-01-29 02:07:29.048307,0 days 00:07:39.213403,80,32,moving_avg,2,2,0.2,1,0.00044386784594768394,11,2,,459.06788754463196,COMPLETE
115,115,0.262736632260704,2025-01-29 02:07:29.049072,2025-01-29 02:26:58.466408,0 days 00:19:29.417336,64,16,moving_avg,2,2,0.1,1,0.000103804707465235,15,2,,1169.305412530899,COMPLETE
116,116,0.2634238296167432,2025-01-29 02:11:47.149065,2025-01-29 02:19:26.918503,0 days 00:07:39.769438,128,16,moving_avg,1,2,0.30000000000000004,1,0.00029390916446423056,15,2,,459.651305437088,COMPLETE
117,117,0.27033217208331367,2025-01-29 02:19:26.919086,2025-01-29 02:25:41.060742,0 days 00:06:14.141656,112,16,moving_avg,1,3,0.1,2,0.0006363907135186715,15,2,,374.00957012176514,COMPLETE
118,118,0.26643996727804536,2025-01-29 02:25:41.061337,2025-01-29 02:30:45.673084,0 days 00:05:04.611747,112,16,moving_avg,1,2,0.30000000000000004,1,0.0003314792810413376,13,4,,304.4888141155243,COMPLETE
119,119,0.2679132787591455,2025-01-29 02:26:58.467103,2025-01-29 02:33:07.705675,0 days 00:06:09.238572,128,16,moving_avg,2,2,0.0,1,0.00029295882425421367,15,2,,369.09807562828064,COMPLETE
120,120,0.26426246915668433,2025-01-29 02:30:45.673708,2025-01-29 02:44:39.887794,0 days 00:13:54.214086,80,16,moving_avg,2,2,0.1,1,0.00016975926715534663,15,3,,834.1051044464111,COMPLETE
121,121,0.2633890763973075,2025-01-29 02:33:07.706410,2025-01-29 02:42:26.599185,0 days 00:09:18.892775,128,16,moving_avg,2,2,0.30000000000000004,1,0.00011176798090521093,15,2,,558.7541677951813,COMPLETE
122,122,0.2669276418693978,2025-01-29 02:42:26.599893,2025-01-29 02:50:10.535287,0 days 00:07:43.935394,80,16,moving_avg,2,2,0.1,1,0.00026847308854840193,15,3,,463.81806564331055,COMPLETE
123,123,0.26424476731470997,2025-01-29 02:44:39.888516,2025-01-29 02:49:07.324771,0 days 00:04:27.436255,96,32,moving_avg,1,2,0.2,1,0.0004095791821470931,17,2,,267.3000044822693,COMPLETE
124,124,0.266499584054636,2025-01-29 02:49:07.325348,2025-01-29 02:56:59.642195,0 days 00:07:52.316847,128,16,moving_avg,2,3,0.30000000000000004,1,0.00028705603262039006,9,1,,472.19735765457153,COMPLETE
125,125,0.26174160237679384,2025-01-29 02:50:10.535918,2025-01-29 03:06:35.714615,0 days 00:16:25.178697,128,16,moving_avg,1,3,0.30000000000000004,1,0.0002168727513281137,15,1,,985.0631382465363,COMPLETE
126,126,0.2656351121508957,2025-01-29 02:56:59.642936,2025-01-29 03:03:51.786326,0 days 00:06:52.143390,128,32,moving_avg,1,2,0.30000000000000004,1,0.00013517386264295494,15,2,,411.9961965084076,COMPLETE
127,127,0.26636534783755966,2025-01-29 03:03:51.786960,2025-01-29 03:09:43.001643,0 days 00:05:51.214683,32,32,moving_avg,1,2,0.0,1,0.00018192703567591098,15,2,,351.10950565338135,COMPLETE
