,number,value,datetime_start,datetime_complete,duration,params_d_ff,params_d_model,params_decomp_method,params_down_sampling_layers,params_down_sampling_window,params_dropout,params_e_layers,params_learning_rate,params_moving_avg,params_top_k,user_attrs_pruned,user_attrs_training_time,state
0,0,0.27414696317830306,2025-01-28 16:11:40.358895,2025-01-28 16:18:47.751622,0 days 00:07:07.392727,112,16,dft_decomp,1,2,0.0,3,0.0004906211471786042,15,2,,427.22081327438354,COMPLETE
1,1,0.2779337141306076,2025-01-28 16:11:40.359983,2025-01-28 16:21:01.236409,0 days 00:09:20.876426,16,32,dft_decomp,1,2,0.2,1,0.0015051259147702324,1,1,,560.7725923061371,COMPLETE
2,2,0.2752583278135002,2025-01-28 16:18:47.752431,2025-01-28 16:31:19.054939,0 days 00:12:31.302508,64,16,moving_avg,2,3,0.4,3,0.0009953984218613297,3,1,,751.1748552322388,COMPLETE
3,3,0.2743246968734824,2025-01-28 16:21:01.237348,2025-01-28 16:29:54.638012,0 days 00:08:53.400664,128,48,dft_decomp,2,2,0.0,2,0.00015100480225530322,23,4,,533.1522181034088,COMPLETE
4,4,0.273930791829991,2025-01-28 16:29:54.638763,2025-01-28 16:40:37.282804,0 days 00:10:42.644041,112,32,moving_avg,2,2,0.0,1,0.007279474405682627,9,3,,642.5207705497742,COMPLETE
5,5,0.27567662537614585,2025-01-28 16:31:19.055761,2025-01-28 16:38:54.475494,0 days 00:07:35.419733,128,48,dft_decomp,1,2,0.4,3,0.00027418846945129096,23,1,,455.1521909236908,COMPLETE
6,6,0.27126961572047587,2025-01-28 16:38:54.476159,2025-01-28 16:44:11.315786,0 days 00:05:16.839627,96,32,dft_decomp,1,4,0.1,2,0.0006432986894037021,21,4,,316.69630241394043,COMPLETE
7,7,0.26587023881291605,2025-01-28 16:40:37.283406,2025-01-28 17:02:59.754557,0 days 00:22:22.471151,112,64,dft_decomp,2,4,0.4,1,0.00021306088073796614,3,4,,1342.2980716228485,COMPLETE
8,8,0.2777838744752091,2025-01-28 16:44:11.316374,2025-01-28 16:51:27.155021,0 days 00:07:15.838647,16,16,moving_avg,1,3,0.4,2,0.0011780395204057392,1,3,,435.77712082862854,COMPLETE
9,9,0.2769138440348898,2025-01-28 16:51:27.155561,2025-01-28 16:58:14.663640,0 days 00:06:47.508079,96,32,dft_decomp,1,4,0.1,3,0.00041530965905523594,17,5,,407.32355403900146,COMPLETE
10,10,0.2807788796247212,2025-01-28 16:58:14.664178,2025-01-28 17:04:11.554270,0 days 00:05:56.890092,64,32,dft_decomp,1,4,0.1,2,0.0029854559579094433,13,2,,356.74730110168457,COMPLETE
11,11,0.2706799874445656,2025-01-28 17:02:59.755138,2025-01-28 17:13:54.644288,0 days 00:10:54.889150,96,64,dft_decomp,2,4,0.5,2,0.00011933135870206557,3,4,,654.641695022583,COMPLETE
12,12,0.26710807559355837,2025-01-28 17:04:11.554822,2025-01-28 17:14:10.784915,0 days 00:09:59.230093,96,64,dft_decomp,2,4,0.4,1,0.00023033249045168784,3,3,,599.0614757537842,COMPLETE
13,13,0.265174839631198,2025-01-28 17:13:54.644855,2025-01-28 17:39:34.598314,0 days 00:25:39.953459,64,64,dft_decomp,2,4,0.5,1,0.00010377043060426534,3,5,,1539.79358792305,COMPLETE
14,14,0.2688140413650317,2025-01-28 17:14:10.785522,2025-01-28 17:25:44.996425,0 days 00:11:34.210903,128,48,dft_decomp,2,3,0.30000000000000004,1,0.0011963165431725625,5,3,,694.0433275699615,COMPLETE
15,15,0.26213986637635883,2025-01-28 17:25:44.997007,2025-01-28 17:39:13.535433,0 days 00:13:28.538426,80,64,dft_decomp,1,4,0.4,1,0.0015656333200612846,9,3,,808.379554271698,COMPLETE
16,16,0.2650517193047365,2025-01-28 17:39:13.536152,2025-01-28 17:46:25.233209,0 days 00:07:11.697057,80,64,dft_decomp,1,3,0.30000000000000004,1,0.0013046086230354883,9,3,,431.5242569446564,COMPLETE
17,17,0.2617392716431429,2025-01-28 17:39:34.598873,2025-01-28 17:57:59.556125,0 days 00:18:24.957252,32,64,dft_decomp,2,3,0.5,1,0.0003236406157350209,7,5,,1104.7794477939606,COMPLETE
18,18,0.268759623132698,2025-01-28 17:46:25.233894,2025-01-28 17:53:58.341516,0 days 00:07:33.107622,48,64,dft_decomp,1,3,0.30000000000000004,1,0.001365941480978116,11,5,,452.9429044723511,COMPLETE
19,19,0.26857117437209377,2025-01-28 17:53:58.342136,2025-01-28 17:58:57.691615,0 days 00:04:59.349479,48,64,dft_decomp,1,4,0.30000000000000004,1,0.00581022224483791,9,2,,299.1985750198364,COMPLETE
20,20,0.26272069870112374,2025-01-28 17:57:59.556956,2025-01-28 18:11:41.762942,0 days 00:13:42.205986,32,64,dft_decomp,2,2,0.4,1,0.00011232433055277258,9,5,,821.9954426288605,COMPLETE
21,21,0.2658922988698709,2025-01-28 17:58:57.692180,2025-01-28 18:09:18.384076,0 days 00:10:20.691896,16,64,dft_decomp,2,2,0.5,1,0.00012509550197891336,13,4,,620.4887461662292,COMPLETE
22,22,0.26672110143672145,2025-01-28 18:09:18.384758,2025-01-28 18:15:45.291303,0 days 00:06:26.906545,112,64,moving_avg,1,4,0.5,1,0.00212236773705541,9,3,,386.74678659439087,COMPLETE
23,23,0.2693568205787991,2025-01-28 18:11:41.763592,2025-01-28 18:20:19.306297,0 days 00:08:37.542705,16,64,dft_decomp,2,3,0.4,2,0.0010098310602399687,7,4,,517.3213341236115,COMPLETE
24,24,0.26566417915207935,2025-01-28 18:15:45.292007,2025-01-28 18:28:41.441595,0 days 00:12:56.149588,32,64,dft_decomp,2,3,0.4,1,0.0004981990509561761,7,5,,775.9669518470764,COMPLETE
25,25,0.2645064088242719,2025-01-28 18:20:19.306890,2025-01-28 18:35:06.995151,0 days 00:14:47.688261,32,64,moving_avg,2,3,0.4,1,0.00038680806865975815,7,4,,887.5267026424408,COMPLETE
26,26,0.27208003809873965,2025-01-28 18:28:41.442181,2025-01-28 18:36:55.292879,0 days 00:08:13.850698,64,48,moving_avg,2,2,0.30000000000000004,2,0.00039675783852118534,11,5,,493.63810563087463,COMPLETE
27,27,0.2622005227164594,2025-01-28 18:35:06.995746,2025-01-28 18:49:59.015604,0 days 00:14:52.019858,48,48,dft_decomp,2,2,0.30000000000000004,2,0.0001885790842529107,13,5,,891.7967190742493,COMPLETE
28,28,0.26468929751973796,2025-01-28 18:36:55.293416,2025-01-28 18:54:26.755096,0 days 00:17:31.461680,48,32,dft_decomp,2,2,0.4,1,0.00013439602866568184,11,5,,1051.3238952159882,COMPLETE
29,29,0.27014620359865854,2025-01-28 18:49:59.016252,2025-01-28 19:02:45.365112,0 days 00:12:46.348860,48,48,dft_decomp,2,2,0.30000000000000004,2,0.0003411541460941739,17,2,,766.1189751625061,COMPLETE
30,30,0.2683067258155711,2025-01-28 18:54:26.755815,2025-01-28 19:04:46.435194,0 days 00:10:19.679379,32,48,dft_decomp,2,2,0.1,3,0.00043666860833762683,17,4,,619.4025619029999,COMPLETE
31,31,0.2675899368206917,2025-01-28 19:02:45.365763,2025-01-28 19:16:02.013760,0 days 00:13:16.647997,32,32,dft_decomp,2,2,0.2,3,0.0002002917835315164,15,4,,796.4422180652618,COMPLETE
32,32,0.2673505528627687,2025-01-28 19:04:46.435845,2025-01-28 19:25:19.330871,0 days 00:20:32.895026,64,64,dft_decomp,2,2,0.2,2,0.00016268074719751182,13,5,,1232.6134524345398,COMPLETE
33,33,0.2714481881570058,2025-01-28 19:16:02.014478,2025-01-28 19:22:42.315843,0 days 00:06:40.301365,96,64,dft_decomp,1,4,0.4,2,0.0022795298704494133,11,3,,400.09216475486755,COMPLETE
34,34,0.26772991623568787,2025-01-28 19:22:42.316402,2025-01-28 19:36:28.132981,0 days 00:13:45.816579,48,64,dft_decomp,2,2,0.2,1,0.00011606915744340943,9,5,,825.6009769439697,COMPLETE
35,35,0.2669250637039963,2025-01-28 19:25:19.331493,2025-01-28 19:41:20.094303,0 days 00:16:00.762810,64,64,dft_decomp,2,2,0.5,1,0.00015630126743571075,7,5,,960.5458035469055,COMPLETE
36,36,0.26456335778761325,2025-01-28 19:36:28.133597,2025-01-28 19:54:53.660339,0 days 00:18:25.526742,80,64,dft_decomp,2,2,0.5,1,0.00023328932985285913,7,5,,1105.3109331130981,COMPLETE
37,37,0.2671736317966182,2025-01-28 19:41:20.094948,2025-01-28 19:46:36.126222,0 days 00:05:16.031274,96,64,dft_decomp,1,4,0.4,1,0.0010117176497498673,13,4,,315.8715326786041,COMPLETE
38,38,0.27597191351223266,2025-01-28 19:46:36.126807,2025-01-28 19:53:04.043291,0 days 00:06:27.916484,64,64,moving_avg,1,4,0.2,1,0.00189414902595473,7,3,,387.77753925323486,COMPLETE
39,39,0.2658129131818296,2025-01-28 19:53:04.043879,2025-01-28 20:07:28.829692,0 days 00:14:24.785813,32,48,dft_decomp,2,2,0.30000000000000004,2,0.00020469067564943863,9,5,,864.5690574645996,COMPLETE
40,40,0.2704624306914251,2025-01-28 19:54:53.660981,2025-01-28 20:05:57.002733,0 days 00:11:03.341752,80,32,moving_avg,2,3,0.0,3,0.00021117007280720826,7,2,,663.1563880443573,COMPLETE
41,41,0.26438992232465713,2025-01-28 20:05:57.003318,2025-01-28 20:13:06.896411,0 days 00:07:09.893093,48,48,dft_decomp,1,4,0.5,1,0.0012478237930370394,13,3,,429.76221990585327,COMPLETE
42,42,0.27702209352721363,2025-01-28 20:07:28.830232,2025-01-28 20:17:44.819321,0 days 00:10:15.989089,48,48,moving_avg,2,4,0.5,1,0.00025763811833518424,1,3,,615.8634648323059,COMPLETE
43,43,0.2665752244989336,2025-01-28 20:13:06.897210,2025-01-28 20:18:04.554572,0 days 00:04:57.657362,32,32,dft_decomp,1,4,0.30000000000000004,1,0.0022029466877929583,13,3,,297.54569149017334,COMPLETE
44,44,0.26854323963892923,2025-01-28 20:17:44.819862,2025-01-28 20:22:29.071034,0 days 00:04:44.251172,32,64,dft_decomp,1,3,0.5,1,0.0009101866489941774,15,3,,284.0942373275757,COMPLETE
45,45,0.26738305834725545,2025-01-28 20:18:04.555244,2025-01-28 20:25:43.374815,0 days 00:07:38.819571,48,48,dft_decomp,1,4,0.4,2,0.0005191113621140217,13,3,,458.6455702781677,COMPLETE
46,46,0.2684576370925659,2025-01-28 20:22:29.071585,2025-01-28 20:28:00.445808,0 days 00:05:31.374223,32,48,dft_decomp,1,4,0.5,2,0.0016006362164626199,13,1,,331.21387577056885,COMPLETE
47,47,0.26647258354871656,2025-01-28 20:25:43.375445,2025-01-28 20:29:20.264881,0 days 00:03:36.889436,64,64,dft_decomp,1,4,0.5,1,0.002208840894013947,11,3,,216.73029112815857,COMPLETE
48,48,0.26632902094360156,2025-01-28 20:28:00.446425,2025-01-28 20:33:26.559876,0 days 00:05:26.113451,48,48,moving_avg,1,4,0.5,2,0.0015724443521086468,11,3,,325.9649097919464,COMPLETE
49,49,0.2683232889173656,2025-01-28 20:29:20.265646,2025-01-28 20:40:52.759890,0 days 00:11:32.494244,32,48,dft_decomp,1,3,0.30000000000000004,1,0.00012032917092858087,23,4,,692.3515231609344,COMPLETE
50,50,0.2700422891572657,2025-01-28 20:33:26.560470,2025-01-28 20:40:17.621143,0 days 00:06:51.060673,128,64,dft_decomp,1,4,0.5,1,0.0005360323762879006,9,1,,410.8775489330292,COMPLETE
51,51,0.26710921529378134,2025-01-28 20:40:17.621901,2025-01-28 20:49:00.238258,0 days 00:08:42.616357,48,64,moving_avg,2,2,0.30000000000000004,1,0.00012118942316837044,23,5,,522.4082441329956,COMPLETE
52,52,0.26768548703086914,2025-01-28 20:40:52.760604,2025-01-28 20:53:10.256698,0 days 00:12:17.496094,32,64,moving_avg,2,3,0.30000000000000004,1,0.0004709186689155571,5,4,,737.3229942321777,COMPLETE
53,53,0.2653925427274674,2025-01-28 20:49:00.238834,2025-01-28 20:56:23.863351,0 days 00:07:23.624517,48,64,moving_avg,2,3,0.30000000000000004,1,0.00047912129449113677,7,3,,443.4588658809662,COMPLETE
54,54,0.28244501848314735,2025-01-28 20:53:10.257434,2025-01-28 21:01:37.728100,0 days 00:08:27.470666,80,32,dft_decomp,1,4,0.5,2,0.004746838293364949,7,3,,507.3085870742798,COMPLETE
55,55,0.26713761990944757,2025-01-28 20:56:23.863971,2025-01-28 21:11:45.977363,0 days 00:15:22.113392,64,32,dft_decomp,1,4,0.5,1,0.0009154048824195642,7,2,,921.9992282390594,COMPLETE
56,56,0.26706709567055276,2025-01-28 21:01:37.728720,2025-01-28 21:15:29.352050,0 days 00:13:51.623330,48,48,moving_avg,2,3,0.5,1,0.0003543088737765766,7,5,,831.4856517314911,COMPLETE
57,57,0.26593176232517285,2025-01-28 21:11:45.977987,2025-01-28 21:23:23.092621,0 days 00:11:37.114634,32,64,moving_avg,2,3,0.5,1,0.00029208988695720537,5,4,,696.9501516819,COMPLETE
58,58,0.26630157874233523,2025-01-28 21:15:29.352646,2025-01-28 21:26:36.187642,0 days 00:11:06.834996,32,48,dft_decomp,2,3,0.5,1,0.00027057406496088285,7,5,,666.6892464160919,COMPLETE
59,59,0.26710094622933994,2025-01-28 21:23:23.093271,2025-01-28 21:37:18.791165,0 days 00:13:55.697894,16,64,dft_decomp,2,3,0.5,1,0.0001486970877521647,7,5,,835.5164494514465,COMPLETE
60,60,0.27370635046750097,2025-01-28 21:26:36.188194,2025-01-28 21:39:10.224728,0 days 00:12:34.036534,48,64,dft_decomp,2,2,0.30000000000000004,1,0.0076265305800118635,11,1,,753.8179504871368,COMPLETE
61,61,0.2763758502000598,2025-01-28 21:37:18.791867,2025-01-28 21:42:51.136094,0 days 00:05:32.344227,96,64,moving_avg,1,3,0.0,2,0.0072110247014571735,13,5,,332.1261622905731,COMPLETE
62,62,0.26538883889165765,2025-01-28 21:39:10.225353,2025-01-28 21:52:41.940537,0 days 00:13:31.715184,112,64,dft_decomp,2,2,0.4,1,0.00022246422986480922,9,5,,811.494217634201,COMPLETE
63,63,0.26300148059356987,2025-01-28 21:42:51.136771,2025-01-28 22:03:36.472194,0 days 00:20:45.335423,96,48,dft_decomp,2,2,0.5,1,0.0005943418664622701,9,5,,1245.1552245616913,COMPLETE
64,64,0.27689521904553255,2025-01-28 21:52:41.941177,2025-01-28 22:12:55.942439,0 days 00:20:14.001262,16,64,dft_decomp,2,4,0.5,1,0.00037996421239831735,1,3,,1213.8361682891846,COMPLETE
65,65,0.27030298361338834,2025-01-28 22:03:36.472932,2025-01-28 22:10:36.070208,0 days 00:06:59.597276,128,48,dft_decomp,2,3,0.4,1,0.001968290894689289,7,5,,419.419495344162,COMPLETE
66,66,0.2641241691928854,2025-01-28 22:10:36.070916,2025-01-28 22:17:16.362446,0 days 00:06:40.291530,16,64,dft_decomp,1,2,0.4,1,0.0002147587666816186,17,5,,400.12369775772095,COMPLETE
67,67,0.2705724583870512,2025-01-28 22:12:55.943012,2025-01-28 22:27:27.859675,0 days 00:14:31.916663,112,48,dft_decomp,2,2,0.5,1,0.000488523928854298,11,4,,871.7347996234894,COMPLETE
68,68,0.26488321046669894,2025-01-28 22:17:16.363029,2025-01-28 22:27:25.880716,0 days 00:10:09.517687,112,32,dft_decomp,2,2,0.5,1,0.00048503028833006567,19,5,,609.3587558269501,COMPLETE
69,69,0.26496958840992896,2025-01-28 22:27:25.881419,2025-01-28 22:33:43.156961,0 days 00:06:17.275542,16,64,dft_decomp,1,2,0.4,1,0.00029201321064943435,17,5,,377.0976605415344,COMPLETE
70,70,0.26632216116517876,2025-01-28 22:27:27.860308,2025-01-28 22:38:54.141218,0 days 00:11:26.280910,32,48,dft_decomp,1,2,0.4,2,0.0005122236011137157,17,5,,686.0963351726532,COMPLETE
71,71,0.27263565441452453,2025-01-28 22:33:43.157703,2025-01-28 22:45:03.357955,0 days 00:11:20.200252,80,48,dft_decomp,2,2,0.4,2,0.00036779229626024656,15,5,,679.9550409317017,COMPLETE
72,72,0.2677952179028235,2025-01-28 22:38:54.141800,2025-01-28 22:49:23.111143,0 days 00:10:28.969343,96,48,dft_decomp,2,2,0.5,1,0.0013197010082841335,17,5,,628.7894716262817,COMPLETE
73,73,0.26698951862748294,2025-01-28 22:45:03.358640,2025-01-28 22:55:08.924229,0 days 00:10:05.565589,64,48,dft_decomp,1,4,0.5,1,0.00038243216854667557,11,4,,605.4313893318176,COMPLETE
74,74,0.26366943405210547,2025-01-28 22:49:23.111844,2025-01-28 22:56:47.569767,0 days 00:07:24.457923,16,64,moving_avg,1,2,0.4,1,0.0003546800851461538,11,4,,444.2886731624603,COMPLETE
75,75,0.2638468554893487,2025-01-28 22:55:08.924990,2025-01-28 23:06:27.057082,0 days 00:11:18.132092,32,64,moving_avg,1,2,0.4,1,0.000140718043080823,11,5,,677.9599802494049,COMPLETE
76,76,0.26583897969621034,2025-01-28 22:56:47.570467,2025-01-28 23:07:09.333112,0 days 00:10:21.762645,64,48,moving_avg,1,2,0.5,1,0.0004044892680324721,13,3,,621.6167371273041,COMPLETE
77,77,0.2711388959916686,2025-01-28 23:06:27.057842,2025-01-28 23:12:27.951014,0 days 00:06:00.893172,48,64,moving_avg,1,2,0.5,2,0.00016485114985822347,11,5,,360.6773133277893,COMPLETE
78,78,0.26535298246726924,2025-01-28 23:07:09.333805,2025-01-28 23:20:10.845251,0 days 00:13:01.511446,16,48,moving_avg,1,2,0.5,1,0.00023802741650609096,11,5,,781.3728179931641,COMPLETE
79,79,0.26361606722541464,2025-01-28 23:12:27.951591,2025-01-28 23:24:58.660025,0 days 00:12:30.708434,32,64,moving_avg,1,2,0.30000000000000004,1,0.00029405301519911753,11,4,,750.5500679016113,COMPLETE
80,80,0.2668705013580995,2025-01-28 23:20:10.845890,2025-01-28 23:27:04.148743,0 days 00:06:53.302853,16,64,moving_avg,1,2,0.4,1,0.0005805499287403618,11,3,,413.14617443084717,COMPLETE
81,81,0.2649922026628746,2025-01-28 23:24:58.660614,2025-01-28 23:34:47.901213,0 days 00:09:49.240599,16,64,moving_avg,1,2,0.4,1,0.0021700319331816793,11,4,,589.0861613750458,COMPLETE
82,82,0.2653349253777523,2025-01-28 23:27:04.149374,2025-01-28 23:34:25.136033,0 days 00:07:20.986659,16,64,moving_avg,1,2,0.30000000000000004,1,0.0002313372734716916,11,3,,440.82444643974304,COMPLETE
83,83,0.2659467375712567,2025-01-28 23:34:25.136600,2025-01-28 23:41:53.621095,0 days 00:07:28.484495,64,64,moving_avg,1,2,0.4,1,0.0008000923585089482,11,5,,448.32184052467346,COMPLETE
84,84,0.2762227211552611,2025-01-28 23:34:47.901796,2025-01-28 23:40:24.414662,0 days 00:05:36.512866,48,64,moving_avg,1,2,0.2,2,0.00042371907999010083,9,4,,336.2972779273987,COMPLETE
85,85,0.26973167613833415,2025-01-28 23:40:24.415312,2025-01-28 23:45:44.499808,0 days 00:05:20.084496,80,64,dft_decomp,1,4,0.30000000000000004,1,0.0013520802473885457,9,1,,319.9260845184326,COMPLETE
86,86,0.26782280663637953,2025-01-28 23:41:53.621671,2025-01-28 23:47:27.236262,0 days 00:05:33.614591,48,48,moving_avg,1,2,0.30000000000000004,1,0.00025487481757680507,15,5,,333.48146986961365,COMPLETE
87,87,0.2662202960808105,2025-01-28 23:45:44.500381,2025-01-28 23:51:11.469046,0 days 00:05:26.968665,16,64,moving_avg,1,3,0.30000000000000004,1,0.0002384164189395784,15,5,,326.8177673816681,COMPLETE
88,88,0.2690178195151717,2025-01-28 23:47:27.236824,2025-01-28 23:52:20.010494,0 days 00:04:52.773670,32,64,moving_avg,1,2,0.30000000000000004,1,0.0005626538434769056,15,5,,292.61170649528503,COMPLETE
89,89,0.2686419448999681,2025-01-28 23:51:11.469643,2025-01-29 00:00:00.710192,0 days 00:08:49.240549,32,64,moving_avg,1,2,0.4,1,0.00017855427638749244,9,5,,529.0796811580658,COMPLETE
90,90,0.2664945389583293,2025-01-28 23:52:20.011053,2025-01-28 23:57:55.433064,0 days 00:05:35.422011,64,64,dft_decomp,1,2,0.4,1,0.00016397836420403537,9,4,,335.2371621131897,COMPLETE
91,91,0.2638687019672632,2025-01-28 23:57:55.433611,2025-01-29 00:14:25.175431,0 days 00:16:29.741820,16,64,dft_decomp,2,2,0.30000000000000004,1,0.00014532977341650524,9,5,,989.5335690975189,COMPLETE
92,92,0.26600538611965324,2025-01-29 00:00:00.710748,2025-01-29 00:15:33.119826,0 days 00:15:32.409078,16,64,dft_decomp,2,2,0.4,1,0.00011987741022429506,13,5,,932.2019507884979,COMPLETE
93,93,0.27315078568530954,2025-01-29 00:14:25.176145,2025-01-29 00:21:11.022006,0 days 00:06:45.845861,128,32,moving_avg,1,2,0.0,3,0.00363140430898673,9,3,,405.6297688484192,COMPLETE
94,94,14.049342307243492,2025-01-29 00:15:33.120384,2025-01-29 00:28:02.537269,0 days 00:12:29.416885,80,16,moving_avg,2,4,0.0,3,0.00957158927848015,3,1,,749.274652004242,COMPLETE
95,95,0.26659300827388915,2025-01-29 00:21:11.022626,2025-01-29 00:34:27.287556,0 days 00:13:16.264930,16,64,dft_decomp,2,2,0.30000000000000004,2,0.00014367968237464335,9,5,,795.9979875087738,COMPLETE
96,96,0.2979311288273958,2025-01-29 00:28:02.537972,2025-01-29 00:36:35.056952,0 days 00:08:32.518980,128,16,dft_decomp,1,4,0.0,3,0.007522373916687725,9,5,,512.3414876461029,COMPLETE
97,97,0.26755038388884966,2025-01-29 00:34:27.288222,2025-01-29 00:41:16.062259,0 days 00:06:48.774037,16,64,dft_decomp,2,2,0.30000000000000004,1,0.00023196067147055203,9,5,,408.5686631202698,COMPLETE
98,98,0.2665326800511035,2025-01-29 00:36:35.057701,2025-01-29 00:46:54.078399,0 days 00:10:19.020698,32,48,dft_decomp,2,2,0.30000000000000004,1,0.00016679361305039242,9,4,,618.8414542675018,COMPLETE
99,99,0.26451563763924396,2025-01-29 00:41:16.062844,2025-01-29 00:59:00.812260,0 days 00:17:44.749416,80,16,dft_decomp,2,3,0.1,2,0.00012165371550877198,7,5,,1064.606600522995,COMPLETE
100,100,0.26961199843430556,2025-01-29 00:46:54.078985,2025-01-29 00:55:23.305086,0 days 00:08:29.226101,64,64,moving_avg,1,2,0.30000000000000004,1,0.00023281763297474886,5,3,,509.06257820129395,COMPLETE
101,101,0.27045916731586733,2025-01-29 00:55:23.305794,2025-01-29 01:04:58.782245,0 days 00:09:35.476451,48,64,dft_decomp,2,3,0.5,2,0.0006129936150888317,7,4,,575.2296521663666,COMPLETE
102,102,0.26737265168574254,2025-01-29 00:59:00.812850,2025-01-29 01:08:11.259212,0 days 00:09:10.446362,80,48,dft_decomp,1,4,0.4,1,0.0009100723493614216,13,3,,550.3108277320862,COMPLETE
103,103,0.26602802447437024,2025-01-29 01:04:58.782856,2025-01-29 01:09:23.999529,0 days 00:04:25.216673,16,48,dft_decomp,1,4,0.4,1,0.0005504441922867772,13,3,,265.093154668808,COMPLETE
104,104,0.26931201649713926,2025-01-29 01:08:11.259775,2025-01-29 01:14:56.356172,0 days 00:06:45.096397,48,48,dft_decomp,1,4,0.5,1,0.0008414889477720875,13,2,,404.96528816223145,COMPLETE
105,105,0.263227215985998,2025-01-29 01:09:24.000226,2025-01-29 01:20:18.906622,0 days 00:10:54.906396,96,16,dft_decomp,2,2,0.2,1,0.00032388139608007383,13,2,,654.775205373764,COMPLETE
106,106,0.2688233706268105,2025-01-29 01:14:56.356738,2025-01-29 01:24:57.428099,0 days 00:10:01.071361,32,48,dft_decomp,1,4,0.5,1,0.0015961761985875671,19,4,,600.9399621486664,COMPLETE
107,107,0.268017116672419,2025-01-29 01:20:18.907238,2025-01-29 01:29:04.267795,0 days 00:08:45.360557,80,16,dft_decomp,2,3,0.1,1,0.00034523344577553033,9,3,,525.251834154129,COMPLETE
108,108,0.2638638620192106,2025-01-29 01:24:57.428720,2025-01-29 01:41:26.244518,0 days 00:16:28.815798,96,16,moving_avg,2,2,0.2,1,0.0002756455193620671,11,2,,988.7006821632385,COMPLETE
109,109,0.2646809468780973,2025-01-29 01:29:04.268376,2025-01-29 01:44:40.924297,0 days 00:15:36.655921,112,16,dft_decomp,2,2,0.2,1,0.00030377168599342986,13,2,,936.5225522518158,COMPLETE
110,110,0.27214379837321984,2025-01-29 01:41:26.245105,2025-01-29 01:48:35.919202,0 days 00:07:09.674097,96,32,dft_decomp,2,2,0.1,1,0.00019921739663847463,11,1,,429.5216886997223,COMPLETE
111,111,0.2674456921768804,2025-01-29 01:44:40.925075,2025-01-29 01:55:41.388636,0 days 00:11:00.463561,48,48,dft_decomp,2,2,0.2,2,0.0004926458294593402,11,5,,660.231546163559,COMPLETE
112,112,0.26685508678228836,2025-01-29 01:48:35.919968,2025-01-29 01:59:49.834186,0 days 00:11:13.914218,96,16,moving_avg,2,2,0.30000000000000004,2,0.00017381497557624067,11,3,,673.7558479309082,COMPLETE
