,number,value,datetime_start,datetime_complete,duration,params_d_ff,params_d_model,params_decomp_method,params_down_sampling_layers,params_down_sampling_window,params_dropout,params_e_layers,params_learning_rate,params_moving_avg,params_top_k,user_attrs_pruned,user_attrs_training_time,state
0,0,0.3780607400147489,2025-01-29 08:18:28.297989,2025-01-29 08:31:56.891577,0 days 00:13:28.593588,16,64,dft_decomp,2,4,0.30000000000000004,3,0.0049638747871832214,5,5,,808.3361992835999,COMPLETE
1,1,0.28901622919805087,2025-01-29 08:18:28.299023,2025-01-29 08:34:51.240964,0 days 00:16:22.941941,16,64,dft_decomp,1,2,0.4,2,0.0005308107665576969,9,5,,982.7295472621918,COMPLETE
2,2,0.2914481678992931,2025-01-29 08:31:56.892310,2025-01-29 08:44:06.333494,0 days 00:12:09.441184,112,48,dft_decomp,1,2,0.2,2,0.0009630824461784101,17,1,,729.2266955375671,COMPLETE
3,3,0.29373437483179404,2025-01-29 08:34:51.241673,2025-01-29 08:48:58.289221,0 days 00:14:07.047548,16,16,moving_avg,1,3,0.4,3,0.004271028411833567,15,3,,846.9663259983063,COMPLETE
4,4,0.2896997804431039,2025-01-29 08:44:06.334202,2025-01-29 09:01:14.087685,0 days 00:17:07.753483,128,16,moving_avg,1,3,0.2,3,0.00012268598937076206,25,4,,1027.6135938167572,COMPLETE
5,5,0.2775944563854071,2025-01-29 08:48:58.289982,2025-01-29 09:00:49.626055,0 days 00:11:51.336073,16,64,dft_decomp,1,3,0.30000000000000004,2,0.00025722165416313465,21,4,,711.1466314792633,COMPLETE
6,6,0.30292015388719656,2025-01-29 09:00:49.626635,2025-01-29 09:07:38.143361,0 days 00:06:48.516726,32,48,moving_avg,2,4,0.0,1,0.005476445504523967,5,2,,408.4094524383545,COMPLETE
7,7,0.284628493426971,2025-01-29 09:01:14.088326,2025-01-29 09:24:07.973248,0 days 00:22:53.884922,16,48,moving_avg,1,4,0.4,2,0.00013420967002904528,5,2,,1373.7637445926666,COMPLETE
8,8,0.29427642071103605,2025-01-29 09:07:38.143997,2025-01-29 09:22:26.692249,0 days 00:14:48.548252,128,48,dft_decomp,2,2,0.5,3,0.00013304400328566232,15,2,,888.2394902706146,COMPLETE
9,9,0.2887533684716745,2025-01-29 09:22:26.692869,2025-01-29 09:34:33.085266,0 days 00:12:06.392397,64,64,dft_decomp,1,3,0.2,2,0.00015039500901879697,21,3,,726.1822609901428,COMPLETE
10,10,0.3353591690222604,2025-01-29 09:24:07.973961,2025-01-29 10:00:16.700872,0 days 00:36:08.726911,64,64,dft_decomp,2,3,0.2,2,0.0006383313323419502,1,4,,2168.4787311553955,COMPLETE
11,11,0.33536789582707244,2025-01-29 09:34:33.085846,2025-01-29 10:06:28.164879,0 days 00:31:55.079033,32,32,dft_decomp,2,3,0.0,1,0.00012221955356003948,1,5,,1914.962558746338,COMPLETE
12,12,0.28455284329450165,2025-01-29 10:00:16.701492,2025-01-29 10:22:05.935666,0 days 00:21:49.234174,32,48,moving_avg,1,4,0.5,3,0.00013808663862254956,11,1,,1309.0669629573822,COMPLETE
13,13,0.27864927240608434,2025-01-29 10:06:28.165429,2025-01-29 10:22:59.879019,0 days 00:16:31.713590,32,48,moving_avg,1,3,0.4,2,0.00023269306436730138,11,1,,991.5692303180695,COMPLETE
14,14,0.29590869631671257,2025-01-29 10:22:05.936216,2025-01-29 10:31:26.310339,0 days 00:09:20.374123,16,64,dft_decomp,1,4,0.2,1,0.0007731966605949327,11,4,,560.2279307842255,COMPLETE
15,15,0.281782426725301,2025-01-29 10:22:59.879600,2025-01-29 10:34:08.159497,0 days 00:11:08.279897,32,64,moving_avg,1,2,0.4,2,0.00019825011157446147,21,2,,668.0787069797516,COMPLETE
16,16,0.2836842579007531,2025-01-29 10:31:26.311080,2025-01-29 10:41:03.926957,0 days 00:09:37.615877,32,48,moving_avg,1,2,0.4,2,0.0003734916073129745,21,1,,577.4434854984283,COMPLETE
17,17,0.29332873448524877,2025-01-29 10:34:08.160164,2025-01-29 10:57:31.901851,0 days 00:23:23.741687,32,32,moving_avg,2,3,0.5,1,0.00034724022777273114,7,2,,1403.6342215538025,COMPLETE
18,18,0.28340513482732405,2025-01-29 10:41:03.927694,2025-01-29 10:53:02.612591,0 days 00:11:58.684897,32,48,moving_avg,1,2,0.2,3,0.00024328393824218905,25,4,,718.4881579875946,COMPLETE
19,19,0.30793283327822296,2025-01-29 10:53:02.613138,2025-01-29 11:04:04.315002,0 days 00:11:01.701864,64,16,moving_avg,1,4,0.30000000000000004,2,0.0003373398407277319,15,2,,661.5967245101929,COMPLETE
20,20,0.2738500211182634,2025-01-29 10:57:31.902537,2025-01-29 11:12:26.219598,0 days 00:14:54.317061,16,64,dft_decomp,1,3,0.2,3,0.0010635395709839859,17,2,,894.06560587883,COMPLETE
21,21,0.28615059285143096,2025-01-29 11:04:04.315724,2025-01-29 11:20:14.603530,0 days 00:16:10.287806,48,48,moving_avg,1,4,0.30000000000000004,2,0.00010826903866865198,17,5,,970.1338784694672,COMPLETE
22,22,0.2845076924622154,2025-01-29 11:12:26.220163,2025-01-29 11:21:00.819014,0 days 00:08:34.598851,16,64,dft_decomp,1,4,0.2,3,0.0008162784163990282,17,2,,514.3697650432587,COMPLETE
23,23,0.2793038846191469,2025-01-29 11:20:14.604215,2025-01-29 11:34:43.640094,0 days 00:14:29.035879,16,64,dft_decomp,1,3,0.30000000000000004,3,0.0013993765742735876,19,1,,868.7931041717529,COMPLETE
24,24,0.34743031918297423,2025-01-29 11:21:00.819537,2025-01-29 11:30:10.691307,0 days 00:09:09.871770,32,64,dft_decomp,2,3,0.0,3,0.00111338796190215,7,2,,549.5957419872284,COMPLETE
25,25,0.2736027415107163,2025-01-29 11:30:10.691963,2025-01-29 11:43:32.755506,0 days 00:13:22.063543,16,32,dft_decomp,1,3,0.5,2,0.0006281890461435085,19,1,,801.9357252120972,COMPLETE
26,26,0.2863868802229396,2025-01-29 11:34:43.640719,2025-01-29 11:50:39.912969,0 days 00:15:56.272250,16,48,dft_decomp,1,3,0.4,1,0.0003979809138629292,13,1,,956.1459817886353,COMPLETE
27,27,0.28627987153721696,2025-01-29 11:43:32.756226,2025-01-29 11:57:15.726728,0 days 00:13:42.970502,48,16,dft_decomp,2,3,0.5,2,0.0010604240013737639,9,2,,822.8436162471771,COMPLETE
28,28,0.2968878641838594,2025-01-29 11:50:39.913652,2025-01-29 11:56:22.645990,0 days 00:05:42.732338,32,48,dft_decomp,1,2,0.1,2,0.002469381039542738,21,2,,342.54286336898804,COMPLETE
29,29,0.29650858366863725,2025-01-29 11:56:22.646534,2025-01-29 12:08:13.423352,0 days 00:11:50.776818,32,16,dft_decomp,1,2,0.4,3,0.0010099903658998812,21,2,,710.6484708786011,COMPLETE
30,30,0.27134690161623237,2025-01-29 11:57:15.727477,2025-01-29 12:20:27.718527,0 days 00:23:11.991050,16,16,dft_decomp,1,2,0.4,2,0.00030338031859875985,21,3,,1391.887636423111,COMPLETE
31,31,0.2650976061775289,2025-01-29 12:08:13.423920,2025-01-29 12:21:10.164427,0 days 00:12:56.740507,16,32,dft_decomp,1,2,0.4,2,0.0013060203623891267,25,1,,776.5971763134003,COMPLETE
32,32,0.3011949152503363,2025-01-29 12:20:27.719287,2025-01-29 12:28:55.970658,0 days 00:08:28.251371,64,16,dft_decomp,1,2,0.4,2,0.00013627112570027054,21,3,,508.1217267513275,COMPLETE
33,33,0.27430447848548556,2025-01-29 12:21:10.165129,2025-01-29 12:34:21.615939,0 days 00:13:11.450810,16,32,dft_decomp,1,2,0.4,2,0.0002739610392878084,25,2,,791.3030035495758,COMPLETE
34,34,0.2742129946886236,2025-01-29 12:28:55.971380,2025-01-29 12:43:13.200872,0 days 00:14:17.229492,16,32,dft_decomp,1,2,0.4,2,0.002274808215056035,25,1,,857.0804986953735,COMPLETE
35,35,0.296367282644901,2025-01-29 12:34:21.616666,2025-01-29 12:46:28.710780,0 days 00:12:07.094114,16,32,dft_decomp,1,3,0.4,2,0.0007911103989916395,25,1,,726.9556715488434,COMPLETE
36,36,0.29082199504819617,2025-01-29 12:43:13.201599,2025-01-29 12:52:26.490851,0 days 00:09:13.289252,32,16,moving_avg,1,2,0.4,2,0.0005256835124630751,17,4,,553.188728094101,COMPLETE
37,37,0.28496585670106384,2025-01-29 12:46:28.711454,2025-01-29 13:00:37.410412,0 days 00:14:08.698958,32,32,dft_decomp,1,3,0.4,2,0.0006151700984481962,17,4,,848.5581014156342,COMPLETE
38,38,0.3354927009179247,2025-01-29 12:52:26.491471,2025-01-29 13:04:03.057156,0 days 00:11:36.565685,16,64,moving_avg,1,3,0.1,3,0.0009365719464997038,19,2,,696.3527290821075,COMPLETE
39,39,0.28373316508102325,2025-01-29 13:00:37.411369,2025-01-29 13:42:25.888377,0 days 00:41:48.477008,16,16,moving_avg,1,2,0.2,1,0.00011377599449487911,19,2,,2508.3987963199615,COMPLETE
40,40,0.27459530324282433,2025-01-29 13:04:03.057860,2025-01-29 13:24:46.148216,0 days 00:20:43.090356,16,16,dft_decomp,1,2,0.5,2,0.00034190657121863,25,4,,1242.993034362793,COMPLETE
41,41,0.2805494528111825,2025-01-29 13:24:46.148804,2025-01-29 13:38:58.274079,0 days 00:14:12.125275,16,64,dft_decomp,1,3,0.0,3,0.00021302627217288794,19,3,,851.8767328262329,COMPLETE
42,42,0.28372127310781853,2025-01-29 13:38:58.274723,2025-01-29 13:53:54.268619,0 days 00:14:55.993896,16,32,dft_decomp,1,2,0.30000000000000004,1,0.002598280751247476,25,1,,895.8858404159546,COMPLETE
43,43,0.3064568829308956,2025-01-29 13:42:25.889005,2025-01-29 13:48:49.534120,0 days 00:06:23.645115,16,48,dft_decomp,1,2,0.5,1,0.008678197020798568,25,2,,383.5097281932831,COMPLETE
44,44,0.280001065052524,2025-01-29 13:48:49.534726,2025-01-29 13:55:51.765008,0 days 00:07:02.230282,32,32,dft_decomp,1,2,0.30000000000000004,2,0.0015985674795269262,25,1,,422.0872166156769,COMPLETE
45,45,0.276468992186549,2025-01-29 13:53:54.269188,2025-01-29 14:01:17.036113,0 days 00:07:22.766925,32,32,dft_decomp,1,2,0.4,2,0.0018567995772245547,25,1,,442.623752117157,COMPLETE
46,46,0.28644309522323785,2025-01-29 13:55:51.765699,2025-01-29 14:18:38.977295,0 days 00:22:47.211596,48,48,dft_decomp,2,2,0.5,2,0.002849631832207604,21,1,,1366.984070777893,COMPLETE
47,47,0.27882101473352977,2025-01-29 14:01:17.036850,2025-01-29 14:13:29.625411,0 days 00:12:12.588561,16,48,moving_avg,1,2,0.5,2,0.00304935978144642,21,1,,732.4187026023865,COMPLETE
48,48,0.34668690371374206,2025-01-29 14:13:29.625998,2025-01-29 14:22:59.116277,0 days 00:09:29.490279,16,48,dft_decomp,2,2,0.4,2,0.004881018182925379,19,1,,569.2790250778198,COMPLETE
49,49,0.2778627783730662,2025-01-29 14:18:38.978018,2025-01-29 14:46:33.713621,0 days 00:27:54.735603,32,16,dft_decomp,1,3,0.2,3,0.00016743959154581238,23,4,,1674.619090795517,COMPLETE
50,50,0.2733332146995929,2025-01-29 14:22:59.116841,2025-01-29 14:36:06.618416,0 days 00:13:07.501575,48,64,dft_decomp,1,3,0.2,3,0.002174080969644424,25,3,,787.2407670021057,COMPLETE
51,51,8.908733239409825,2025-01-29 14:36:06.619113,2025-01-29 14:42:31.601642,0 days 00:06:24.982529,64,64,dft_decomp,1,3,0.0,3,0.007171040964852953,21,3,,384.71118569374084,COMPLETE
52,52,0.2772910610031894,2025-01-29 14:42:31.602293,2025-01-29 15:02:29.244593,0 days 00:19:57.642300,16,48,dft_decomp,1,3,0.2,3,0.003208028263341861,25,3,,1197.4474475383759,COMPLETE
53,53,0.31333191621676093,2025-01-29 14:46:33.714183,2025-01-29 14:55:38.405520,0 days 00:09:04.691337,32,48,dft_decomp,1,2,0.2,3,0.0006616683505624103,25,3,,544.4612789154053,COMPLETE
54,54,0.29667248692150894,2025-01-29 14:55:38.406154,2025-01-29 15:03:46.594624,0 days 00:08:08.188470,48,64,dft_decomp,1,3,0.30000000000000004,3,0.0013148079786252339,25,3,,487.9291636943817,COMPLETE
55,55,0.27549738402513874,2025-01-29 15:02:29.245151,2025-01-29 15:22:04.414924,0 days 00:19:35.169773,16,32,moving_avg,1,4,0.5,3,0.002511184975561652,21,1,,1175.0473308563232,COMPLETE
56,56,0.2761486285434331,2025-01-29 15:03:46.595280,2025-01-29 15:24:07.841088,0 days 00:20:21.245808,16,32,dft_decomp,2,2,0.30000000000000004,2,0.00023901859686229287,21,4,,1221.0794038772583,COMPLETE
57,57,0.2720108605737556,2025-01-29 15:22:04.415541,2025-01-29 15:34:26.699349,0 days 00:12:22.283808,32,16,dft_decomp,1,2,0.2,2,0.0006848503163512617,25,3,,742.173671245575,COMPLETE
58,58,0.28333291488439,2025-01-29 15:24:07.841799,2025-01-29 15:36:08.993976,0 days 00:12:01.152177,16,16,dft_decomp,1,3,0.5,2,0.00031667951502181095,25,1,,721.0520966053009,COMPLETE
59,59,0.3403038548486304,2025-01-29 15:34:26.700040,2025-01-29 15:40:40.969008,0 days 00:06:14.268968,96,48,dft_decomp,1,4,0.30000000000000004,3,0.004624666835118887,15,3,,374.02663683891296,COMPLETE
60,60,0.27411750200028134,2025-01-29 15:36:08.994706,2025-01-29 15:47:16.735748,0 days 00:11:07.741042,32,16,dft_decomp,1,2,0.2,2,0.0008569030653723939,15,2,,667.6238453388214,COMPLETE
61,61,2002.5916773974295,2025-01-29 15:40:40.969600,2025-01-29 15:46:50.836963,0 days 00:06:09.867363,32,64,moving_avg,1,2,0.2,3,0.007661624238284988,15,4,,369.6262662410736,COMPLETE
62,62,0.2814241763936218,2025-01-29 15:46:50.837649,2025-01-29 16:03:58.628539,0 days 00:17:07.790890,16,16,dft_decomp,1,2,0.1,2,0.0005705116358406061,25,3,,1027.6912052631378,COMPLETE
63,63,0.2839773066443328,2025-01-29 15:47:16.736509,2025-01-29 16:01:17.807700,0 days 00:14:01.071191,16,16,dft_decomp,1,2,0.1,2,0.0015114919223898978,15,3,,840.9658212661743,COMPLETE
64,64,0.28926752027512703,2025-01-29 16:01:17.808341,2025-01-29 16:16:09.524637,0 days 00:14:51.716296,64,16,dft_decomp,1,3,0.2,2,0.0012061236858231295,13,2,,891.5917446613312,COMPLETE
65,65,0.29549677683077924,2025-01-29 16:03:58.629378,2025-01-29 16:10:36.885529,0 days 00:06:38.256151,96,32,dft_decomp,1,2,0.1,1,0.00040001820095576383,13,2,,398.1117744445801,COMPLETE
66,66,0.26982789540882907,2025-01-29 16:10:36.886209,2025-01-29 16:35:36.736827,0 days 00:24:59.850618,16,32,dft_decomp,1,4,0.5,3,0.0003533769913527874,17,2,,1499.6952731609344,COMPLETE
67,67,0.27598477296757706,2025-01-29 16:16:09.525332,2025-01-29 16:29:30.259728,0 days 00:13:20.734396,16,16,dft_decomp,1,2,0.30000000000000004,2,0.0006036815883881643,17,3,,800.6284830570221,COMPLETE
68,68,0.2760606382062479,2025-01-29 16:29:30.260328,2025-01-29 16:52:43.741365,0 days 00:23:13.481037,32,16,moving_avg,1,2,0.2,2,0.001264935712304049,17,1,,1393.3820774555206,COMPLETE
69,69,0.2658257505264825,2025-01-29 16:35:36.737571,2025-01-29 17:13:19.967382,0 days 00:37:43.229811,16,32,dft_decomp,1,4,0.4,3,0.0004618237175422547,19,3,,2263.0777060985565,COMPLETE
70,70,0.26581507026967927,2025-01-29 16:52:43.742094,2025-01-29 17:23:04.866391,0 days 00:30:21.124297,32,32,dft_decomp,1,4,0.4,3,0.00012041830956947358,21,2,,1820.9651091098785,COMPLETE
71,71,0.2932613678559463,2025-01-29 17:13:19.967954,2025-01-29 17:41:24.879485,0 days 00:28:04.911531,16,32,dft_decomp,2,4,0.5,3,0.0003513686291072726,3,3,,1684.7572994232178,COMPLETE
72,72,0.2905004570123585,2025-01-29 17:23:04.866974,2025-01-29 17:38:57.661935,0 days 00:15:52.794961,16,16,dft_decomp,1,4,0.5,3,0.0006467931313976727,19,3,,952.6930158138275,COMPLETE
73,73,0.27357494811276367,2025-01-29 17:38:57.662508,2025-01-29 17:53:12.421623,0 days 00:14:14.759115,48,32,dft_decomp,1,4,0.2,3,0.0007880726829761067,19,4,,854.5865428447723,COMPLETE
74,74,0.28070522935055364,2025-01-29 17:41:24.880038,2025-01-29 17:58:42.369208,0 days 00:17:17.489170,48,16,dft_decomp,1,4,0.2,3,0.0001641583257942603,19,1,,1037.3590140342712,COMPLETE
75,75,0.25491108950162167,2025-01-29 17:53:12.422353,2025-01-29 18:15:59.087659,0 days 00:22:46.665306,16,48,dft_decomp,1,4,0.5,3,0.0004964932326713193,21,2,,1366.4711287021637,COMPLETE
76,76,0.3157899386296031,2025-01-29 17:58:42.369811,2025-01-29 18:13:33.537366,0 days 00:14:51.167555,64,48,moving_avg,1,4,0.1,3,0.0016940507880130946,21,5,,890.9730491638184,COMPLETE
77,77,0.26695077866562106,2025-01-29 18:13:33.538002,2025-01-29 18:45:24.030914,0 days 00:31:50.492912,16,48,dft_decomp,1,4,0.5,3,0.00022867192936698336,21,2,,1910.3018157482147,COMPLETE
78,78,0.2716664044499985,2025-01-29 18:15:59.088273,2025-01-29 18:32:08.628225,0 days 00:16:09.539952,16,48,dft_decomp,1,4,0.5,3,0.0007209982352841362,21,3,,969.3516795635223,COMPLETE
79,79,0.265973396037863,2025-01-29 18:32:08.628956,2025-01-29 18:48:11.209839,0 days 00:16:02.580883,48,48,dft_decomp,1,4,0.5,3,0.00032783219023488315,21,2,,962.3668413162231,COMPLETE
80,80,0.2847039295081746,2025-01-29 18:45:24.031564,2025-01-29 19:09:18.206286,0 days 00:23:54.174722,48,32,dft_decomp,1,4,0.5,3,0.00010134447309499434,19,2,,1433.9956860542297,COMPLETE
81,81,0.2632952234612917,2025-01-29 18:48:11.210698,2025-01-29 19:30:01.354613,0 days 00:41:50.143915,48,32,dft_decomp,1,4,0.5,3,0.0001136748207172741,19,2,,2509.97124004364,COMPLETE
82,82,0.26016551162979384,2025-01-29 19:09:18.207081,2025-01-29 19:34:20.603640,0 days 00:25:02.396559,96,64,dft_decomp,1,4,0.5,3,0.00018198328863807927,19,2,,1502.107718706131,COMPLETE
83,83,0.2692145962381474,2025-01-29 19:30:01.355389,2025-01-29 19:51:44.579763,0 days 00:21:43.224374,32,48,dft_decomp,1,4,0.4,3,0.0006927715071797035,19,1,,1303.0202491283417,COMPLETE
84,84,0.2826442793985448,2025-01-29 19:34:20.604302,2025-01-29 19:47:44.337771,0 days 00:13:23.733469,112,64,dft_decomp,1,4,0.5,3,0.00021931059689474358,19,2,,803.4402434825897,COMPLETE
85,85,0.27419407675118107,2025-01-29 19:47:44.338475,2025-01-29 20:12:12.937800,0 days 00:24:28.599325,16,64,dft_decomp,1,4,0.4,3,0.00020922478574572553,19,2,,1468.3639211654663,COMPLETE
86,86,0.27582602709877196,2025-01-29 19:51:44.580392,2025-01-29 20:10:36.786821,0 days 00:18:52.206429,48,64,dft_decomp,1,4,0.5,3,0.00017550673773848182,19,1,,1131.9569697380066,COMPLETE
87,87,0.27990063774107005,2025-01-29 20:10:36.787421,2025-01-29 20:22:45.293207,0 days 00:12:08.505786,96,48,moving_avg,1,4,0.5,3,0.00020273373895256307,19,2,,728.2784330844879,COMPLETE
88,88,0.25705771531846916,2025-01-29 20:12:12.938460,2025-01-29 20:55:40.249364,0 days 00:43:27.310904,16,48,dft_decomp,1,4,0.5,3,0.00030854014001798483,19,1,,2607.1243669986725,COMPLETE
89,89,0.2911911053424891,2025-01-29 20:22:45.294162,2025-01-29 20:39:01.470224,0 days 00:16:16.176062,32,32,moving_avg,1,4,0.4,3,0.00014007491856036803,19,3,,976.0443940162659,COMPLETE
90,90,0.2685825033327862,2025-01-29 20:39:01.470817,2025-01-29 20:49:16.203201,0 days 00:10:14.732384,32,48,dft_decomp,1,4,0.5,3,0.0015961283162092784,21,1,,614.5360841751099,COMPLETE
91,91,0.38463738785667473,2025-01-29 20:49:16.203816,2025-01-29 20:55:01.920343,0 days 00:05:45.716527,32,48,dft_decomp,1,4,0.4,3,0.0059571930357106475,21,2,,345.5202884674072,COMPLETE
92,92,0.2716786000014136,2025-01-29 20:55:01.920911,2025-01-29 21:06:05.264728,0 days 00:11:03.343817,16,48,dft_decomp,1,4,0.30000000000000004,3,0.0008465420484355142,21,1,,663.1526758670807,COMPLETE
93,93,0.2859143809344431,2025-01-29 20:55:40.249958,2025-01-29 21:06:32.506707,0 days 00:10:52.256749,64,48,dft_decomp,1,4,0.5,2,0.0004636027921519122,21,3,,652.0767638683319,COMPLETE
94,94,0.27693393289343243,2025-01-29 21:06:05.265502,2025-01-29 21:23:39.098592,0 days 00:17:33.833090,64,48,dft_decomp,1,4,0.5,3,0.001838435578086353,21,1,,1053.6037287712097,COMPLETE
95,95,0.31233247554067795,2025-01-29 21:06:32.507499,2025-01-29 21:18:46.492483,0 days 00:12:13.984984,96,16,dft_decomp,1,4,0.5,3,0.0007047618120310044,21,2,,733.823061466217,COMPLETE
96,96,0.2622314907280331,2025-01-29 21:18:46.493077,2025-01-29 21:44:15.747241,0 days 00:25:29.254164,16,48,dft_decomp,1,4,0.5,3,0.002847588013104545,21,1,,1529.0537433624268,COMPLETE
97,97,0.29505915159022195,2025-01-29 21:23:39.099258,2025-01-29 21:39:32.992343,0 days 00:15:53.893085,64,64,dft_decomp,2,4,0.5,3,0.0005899959166926591,5,3,,953.618371963501,COMPLETE
98,98,0.33717920127056084,2025-01-29 21:39:32.993007,2025-01-29 22:16:33.716231,0 days 00:37:00.723224,48,48,dft_decomp,2,4,0.5,3,0.000282213164365929,1,1,,2220.5027327537537,COMPLETE
99,99,0.2727148996196109,2025-01-29 21:44:15.747951,2025-01-29 22:23:46.983747,0 days 00:39:31.235796,16,32,dft_decomp,1,4,0.4,3,0.00021739948313891468,19,4,,2371.086445093155,COMPLETE
100,100,0.35256815179079987,2025-01-29 22:16:33.716901,2025-01-29 22:22:54.331293,0 days 00:06:20.614392,16,32,dft_decomp,1,4,0.5,3,0.008179253057808101,19,1,,380.4704360961914,COMPLETE
101,101,0.2656409545091332,2025-01-29 22:22:54.331876,2025-01-29 22:56:40.535579,0 days 00:33:46.203703,16,48,dft_decomp,1,4,0.5,3,0.00020834416748151464,21,2,,2026.01482629776,COMPLETE
102,102,0.27164534650590116,2025-01-29 22:23:46.984473,2025-01-29 22:41:29.114899,0 days 00:17:42.130426,48,32,dft_decomp,1,3,0.30000000000000004,3,0.00018715438621052046,21,2,,1061.9535913467407,COMPLETE
103,103,0.2583972879442773,2025-01-29 22:41:29.115587,2025-01-29 22:58:13.997208,0 days 00:16:44.881621,16,64,dft_decomp,1,4,0.5,3,0.0009643599181685115,21,1,,1004.637365102768,COMPLETE
104,104,0.2730629038885191,2025-01-29 22:56:40.536238,2025-01-29 23:11:35.681299,0 days 00:14:55.145061,32,48,dft_decomp,1,4,0.4,2,0.00021054166184629157,21,2,,894.9802324771881,COMPLETE
105,105,0.2660891528602079,2025-01-29 22:58:13.997818,2025-01-29 23:16:24.375003,0 days 00:18:10.377185,16,64,dft_decomp,1,3,0.5,3,0.0007542108693512939,23,2,,1090.1339185237885,COMPLETE
106,106,0.26708384895085896,2025-01-29 23:11:35.681894,2025-01-29 23:28:01.196378,0 days 00:16:25.514484,80,64,dft_decomp,1,3,0.5,3,0.000281181692279131,23,4,,985.2403454780579,COMPLETE
107,107,0.2870813200340587,2025-01-29 23:16:24.375646,2025-01-29 23:38:52.808493,0 days 00:22:28.432847,80,64,dft_decomp,1,4,0.4,3,0.0003403960295293566,19,3,,1348.157133102417,COMPLETE
108,108,0.25179582236132597,2025-01-29 23:28:01.197055,2025-01-30 00:08:20.689411,0 days 00:40:19.492356,96,48,dft_decomp,1,4,0.4,3,0.0001229385209358772,17,1,,2419.2570383548737,COMPLETE
109,109,0.28845120179245565,2025-01-29 23:38:52.809140,2025-01-29 23:49:31.768910,0 days 00:10:38.959770,16,64,dft_decomp,1,4,0.5,3,0.0011758325779768649,17,1,,638.7259194850922,COMPLETE
110,110,0.27692657454827513,2025-01-29 23:49:31.769514,2025-01-29 23:58:41.760291,0 days 00:09:09.990777,80,48,dft_decomp,1,4,0.5,3,0.00031099161168623247,21,2,,549.7684955596924,COMPLETE
111,111,0.26151594998973887,2025-01-29 23:58:41.760940,2025-01-30 00:14:05.342315,0 days 00:15:23.581375,96,64,dft_decomp,1,4,0.30000000000000004,3,0.00020849973320113296,21,1,,923.3032741546631,COMPLETE
112,112,0.2818959689990363,2025-01-30 00:08:20.690052,2025-01-30 00:24:03.744792,0 days 00:15:43.054740,112,48,dft_decomp,1,4,0.4,2,0.00011565573058083609,17,2,,942.8535568714142,COMPLETE
113,113,0.2882508991192216,2025-01-30 00:14:05.342928,2025-01-30 00:22:10.007011,0 days 00:08:04.664083,80,64,dft_decomp,1,4,0.2,2,0.0002622001758749595,17,1,,484.45182514190674,COMPLETE
