,number,value,datetime_start,datetime_complete,duration,params_d_ff,params_d_model,params_decomp_method,params_down_sampling_layers,params_down_sampling_window,params_dropout,params_e_layers,params_learning_rate,params_moving_avg,params_top_k,user_attrs_pruned,user_attrs_training_time,state
114,114,0.28243453408449554,2025-01-30 00:22:10.007573,2025-01-30 00:38:00.200166,0 days 00:15:50.192593,96,48,dft_decomp,1,4,0.4,3,0.00011812664098188415,17,2,,949.9575979709625,COMPLETE
115,115,0.29483704488498397,2025-01-30 00:24:03.745402,2025-01-30 00:33:29.525939,0 days 00:09:25.780537,96,64,dft_decomp,1,4,0.2,3,0.00015429925364886306,17,1,,565.5059163570404,COMPLETE
116,116,0.29688875187340624,2025-01-30 00:33:29.526571,2025-01-30 00:42:27.959068,0 days 00:08:58.432497,112,64,dft_decomp,1,3,0.30000000000000004,3,0.0002619923207898668,23,1,,538.1347665786743,COMPLETE
117,117,0.2754320118291776,2025-01-30 00:38:00.200727,2025-01-30 00:58:39.190039,0 days 00:20:38.989312,112,48,dft_decomp,1,4,0.4,3,0.00015963774527586827,21,1,,1238.7460770606995,COMPLETE
118,118,0.29006114134540073,2025-01-30 00:42:27.959801,2025-01-30 01:36:05.465825,0 days 00:53:37.506024,32,32,dft_decomp,2,4,0.2,3,0.00014854612211124985,3,3,,3217.3306500911713,COMPLETE
119,119,0.3010213138182644,2025-01-30 00:58:39.190670,2025-01-30 01:09:34.155726,0 days 00:10:54.965056,16,48,moving_avg,1,4,0.5,3,0.0006547724634517321,19,1,,654.8022067546844,COMPLETE
120,120,0.2884706509273592,2025-01-30 01:09:34.156346,2025-01-30 01:22:02.525170,0 days 00:12:28.368824,64,16,dft_decomp,1,4,0.4,3,0.00015277480162286149,21,3,,748.2255568504333,COMPLETE
121,121,0.26890047739626005,2025-01-30 01:22:02.525838,2025-01-30 02:01:56.206296,0 days 00:39:53.680458,16,32,dft_decomp,1,4,0.4,3,0.00016964492418907704,17,2,,2393.5305643081665,COMPLETE
122,122,0.27155130411674255,2025-01-30 01:36:05.466589,2025-01-30 02:11:12.210968,0 days 00:35:06.744379,16,48,dft_decomp,1,3,0.4,3,0.00011322148246645673,23,1,,2106.5322835445404,COMPLETE
123,123,0.2844811070005756,2025-01-30 02:01:56.206932,2025-01-30 02:16:09.210947,0 days 00:14:13.004015,48,32,dft_decomp,1,4,0.5,3,0.0002371087743175651,21,1,,852.8326399326324,COMPLETE
124,124,0.2910314836960368,2025-01-30 02:11:12.211738,2025-01-30 02:17:39.348754,0 days 00:06:27.137016,16,32,moving_avg,1,4,0.5,1,0.0032019748068138187,21,5,,387.03649377822876,COMPLETE
125,125,0.3233601183926268,2025-01-30 02:16:09.211534,2025-01-30 02:30:15.741148,0 days 00:14:06.529614,16,64,dft_decomp,2,4,0.5,3,0.0019983399995003636,5,2,,846.2713251113892,COMPLETE
126,126,0.29006704965300983,2025-01-30 02:17:39.349377,2025-01-30 02:33:39.675194,0 days 00:16:00.325817,80,64,dft_decomp,1,4,0.4,3,0.0002565553827086864,19,1,,960.0573663711548,COMPLETE
127,127,0.27852798575085846,2025-01-30 02:30:15.741745,2025-01-30 02:42:34.935884,0 days 00:12:19.194139,64,48,dft_decomp,1,4,0.30000000000000004,3,0.00018998544647387644,19,1,,738.9780628681183,COMPLETE
